<?xml version="1.0" encoding="UTF-8" standalone="yes"?>
<person xmlns="http://www.mash.data.com/mashModel" schemaLocation="http://www.mash.data.com/mashModel mashModel.xsd ">
    <id>homer</id>
	<firstName>Homer</firstName>
	<lastName>Simpson</lastName>
	<dateOfBirth>1955-05-12</dateOfBirth>
    <gender>Male</gender>
	<homeAddress>
	   <location>
	   <id>springfield742</id>
	  </location>	
	</homeAddress>
	<household>
	<relation>
	<type>married</type>
	<person>
	 <id>marge</id>
</person>
</relation>
<relation>
  <type>father</type>
<person>
	 <id>bart</id>
</person>
</relation>
<relation>
  <type>father</type>
	<person>
	 <id>lisa</id>
</person>
</relation>
<relation>
    <type>father</type>
	<person>
	 <id>maggie</id>
</person>
</relation>
</household>
</person>
