<?xml version="1.0" encoding="UTF-8" standalone="yes"?>
<tns:persons xmlns:tns="http://www.mash.data.com/mashModel" schemaLocation="http://www.mash.data.com/mashModel mashModel.xsd ">
<tns:person>
    <tns:id>person1</tns:id>
	<tns:firstName>first</tns:firstName>
	<tns:lastName>dfdfsda</tns:lastName>
	<tns:homeAddress>
	   <tns:location>
		<tns:city>Sutton</tns:city>
	  </tns:location>	
	</tns:homeAddress>
</tns:person>
</tns:persons>
