<?xml version="1.0" encoding="UTF-8" standalone="yes"?>
<person xmlns="http://www.mash.data.com/mashModel" schemaLocation="http://www.mash.data.com/mashModel mashModel.xsd ">
   <id>lisa</id>
	<firstName>Lisa</firstName>
	<lastName>Simpson</lastName>
	<dateOfBirth>2007-09-28</dateOfBirth>
    <gender>Female</gender>
	<homeAddress>
	   <location>
	   <id>springfield742</id>
	  </location>	
	</homeAddress>
	<household>
	<relation>
	<type>daughter</type>
	<person>
	 <id>marge</id>
</person>
</relation>
<relation>
  <type>daughter</type>
<person>
	 <id>homer</id>
</person>
</relation>
<relation>
  <type>sibiling</type>
	<person>
	   <id>bart</id>
</person>
</relation>
<relation>
    <type>sibiling</type>
	<person>
	 <id>maggie</id>
</person>
</relation>
</household>
</person>
