<?xml version="1.0" encoding="UTF-8" standalone="yes"?>
<person xmlns="http://www.mash.data.com/mashModel" schemaLocation="http://www.mash.data.com/mashModel mashModel.xsd ">
	 <id>marge</id>
	<firstName>Marge</firstName>
	<lastName>Simpson</lastName>
	<dateOfBirth>1954-03-19</dateOfBirth>
    <gender>Female</gender>
	<homeAddress>
	   <location>
	   <id>springfield742</id>
	   <numberOrName>742</numberOrName>
	    <street>Evergreen Terrace</street>
		<city>Springfield</city>
	  </location>	
	</homeAddress>
	<household>
	<relation>
	<type>married</type>
	<person>
	  <id>homer</id>
</person>
</relation>
<relation>
  <type>mother</type>
<person>
	 <id>bart</id>
</person>
</relation>
<relation>
  <type>mother</type>
	<person>
	 <id>lisa</id>
</person>
</relation>
<relation>
    <type>mother</type>
	<person>
	 <id>maggie</id>
</person>
</relation>
</household>
</person>
