<?xml version="1.0" encoding="UTF-8"?>
<tns:person xmlns:tns="http://www.mash.data.com/mashModel" xmlns:xsi="http://www.w3.org/2001/XMLSchema-instance" xsi:schemaLocation="http://www.mash.data.com/mashModel mashModel.xsd ">
  <tns:id>tns:id</tns:id>
   <tns:firstName></tns:firstName>
   <tns:lastName></tns:lastName>
   <tns:homeAddress>
       <tns:id>addressId</tns:id>
   </tns:homeAddress>
   <tns:participations>
       <tns:subjectOf>
           <tns:referral>
               <tns:id>xxx</tns:id>
           </tns:referral>
       </tns:subjectOf>
       <tns:victim>
             <tns:crime>
                 <tns:id>xxxx</tns:id>
             </tns:crime>
       </tns:victim>
   </tns:participations>
   <tns:household>
      <tns:parent>
         <tns:person>
             <tns:id>id_parent</tns:id>
         </tns:person>
      </tns:parent>
       <tns:parent>
         <tns:person>
             <tns:id>id_parent</tns:id>
         </tns:person>
      </tns:parent>
       <tns:sibiling>
         <tns:person>
             <tns:id>id_parent</tns:id>
         </tns:person>
      </tns:sibiling>
   </tns:household>
</tns:person>
