<?xml version="1.0" encoding="UTF-8" standalone="yes"?>
<person xmlns="http://www.mash.data.com/mashModel" schemaLocation="http://www.mash.data.com/mashModel mashModel.xsd ">
     <id>bart</id>
	<firstName>Bart</firstName>
	<lastName>Simpson</lastName>
	<dateOfBirth>2005-04-01</dateOfBirth>
    <gender>Male</gender>
	<homeAddress>
	   <location>
	   <id>springfield742</id>
	   </location>
	</homeAddress>
	<household>
	<relation>
	<type>son</type>
	<person>
	 <id>marge</id>
</person>
</relation>
<relation>
  <type>son</type>
<person>
	 <id>homer</id>
</person>
</relation>
<relation>
  <type>sibiling</type>
	<person>
	 <id>lisa</id>
</person>
</relation>
<relation>
    <type>sibiling</type>
	<person>
	 <id>maggie</id>
</person>
</relation>
</household>
</person>
