<?xml version="1.0" encoding="UTF-8" standalone="yes"?>
<location xmlns="http://www.mash.data.com/mashModel"
	schemaLocation="http://www.mash.data.com/mashModel mashModel.xsd ">
	<id>flandersaddress</id>
	<numberOrName>744</numberOrName>
	<street>Evergreen Terrace</street>
	<city>Springfield</city>
    <postcode>28005</postcode>
	<occupants>
		<person>
			<id>neil</id>
			<firstName>Neil</firstName>
			<lastName>Flanders</lastName>
			<dateOfBirth>1955-05-12</dateOfBirth>
			<gender>Male</gender>
			<homeAddress>
				<location>
				    <id>flandersaddress</id>
					<numberOrName>744</numberOrName>
					<street>Evergreen Terrace</street>
					<city>Springfield</city>
				</location>
			</homeAddress>
		</person>
	</occupants>
</location>	
